{
  "$schema": "https://json-schema.org/draft/2020-12/schema",
  "$id": "https://cogs.dev/schemas/integration-v1alpha1.json",
  "title": "Cogs integration rule group",
  "type": "object",
  "additionalProperties": false,
  "required": ["version", "id", "preset_revision", "dns", "rules", "auth"],
  "properties": {
    "version": { "const": "cogs.integration/v1alpha1" },
    "id": { "$ref": "#/$defs/opaqueId" },
    "preset_revision": { "$ref": "#/$defs/digest" },
    "dns": {
      "type": "object",
      "additionalProperties": false,
      "required": ["mode", "guest_resolution"],
      "properties": {
        "mode": { "const": "proxy-connect-authority" },
        "guest_resolution": { "const": false }
      }
    },
    "rules": {
      "type": "array",
      "minItems": 1,
      "maxItems": 64,
      "items": { "$ref": "#/$defs/rule" }
    },
    "auth": { "$ref": "#/$defs/auth" }
  },
  "$defs": {
    "opaqueId": {
      "type": "string",
      "minLength": 1,
      "maxLength": 128,
      "pattern": "^[A-Za-z0-9][A-Za-z0-9._:-]*$"
    },
    "digest": {
      "type": "string",
      "pattern": "^sha256:[a-f0-9]{64}$"
    },
    "host": {
      "type": "string",
      "minLength": 1,
      "maxLength": 253,
      "pattern": "^(?=.{1,253}$)(?:[a-z0-9](?:[a-z0-9-]{0,61}[a-z0-9])?\\.)*[a-z0-9](?:[a-z0-9-]{0,61}[a-z0-9])?$"
    },
    "rule": {
      "type": "object",
      "additionalProperties": false,
      "required": [
        "name",
        "host",
        "port",
        "methods",
        "path_patterns",
        "path_policy",
        "query_policy",
        "redirects",
        "inject_auth"
      ],
      "properties": {
        "name": { "$ref": "#/$defs/opaqueId" },
        "host": { "$ref": "#/$defs/host" },
        "port": { "type": "integer", "minimum": 1, "maximum": 65535 },
        "methods": {
          "type": "array",
          "minItems": 1,
          "uniqueItems": true,
          "maxItems": 7,
          "items": { "enum": ["DELETE", "GET", "HEAD", "OPTIONS", "PATCH", "POST", "PUT"] }
        },
        "path_patterns": {
          "type": "array",
          "minItems": 1,
          "maxItems": 128,
          "uniqueItems": true,
          "items": {
            "type": "string",
            "minLength": 1,
            "maxLength": 2048,
            "description": "Raw canonical ASCII path, at most 2048 bytes. No percent encoding, whitespace, Unicode, backslash, fragment, query, semicolon, repeated slash or dot-only segments. Semantic lowering also rejects adjacent stars; exact/prefix forbid stars. Segment-glob stars consume one or more bytes within one segment. No regex input.",
            "pattern": "^/(?!.*[%?#;\\\\])(?!.*//)(?!\\.+(?:/|$))(?!.*?/\\.+(?:/|$))[\\x21-\\x7e]*$"
          }
        },
        "path_policy": {
          "type": "object",
          "additionalProperties": false,
          "required": ["strategy", "normalization"],
          "properties": {
            "strategy": { "enum": ["exact", "prefix", "segment-glob"] },
            "normalization": {
              "const": "reject-ambiguous",
              "description": "Validate original bytes without URL decoding or normalization; authorized bytes must be forwarded unchanged. Exact queries are sorted nonempty ASCII key=value pairs, never decoded. Scoped npm encoded metadata and encoded/Unicode Git or package paths are unsupported."
            }
          }
        },
        "query_policy": {
          "oneOf": [
            {
              "type": "object",
              "additionalProperties": false,
              "required": ["mode"],
              "properties": { "mode": { "const": "deny" } }
            },
            {
              "type": "object",
              "additionalProperties": false,
              "required": ["mode", "values"],
              "properties": {
                "mode": { "const": "exact" },
                "values": {
                  "type": "array",
                  "minItems": 1,
                  "maxItems": 16,
                  "uniqueItems": true,
                  "items": {
                    "type": "string",
                    "minLength": 3,
                    "maxLength": 256,
                    "pattern": "^[A-Za-z0-9._~-]+=[A-Za-z0-9._~-]+$"
                  }
                }
              }
            }
          ]
        },
        "redirects": {
          "type": "object",
          "additionalProperties": false,
          "required": ["mode", "max_hops", "allowed_hosts"],
          "properties": {
            "mode": { "enum": ["deny", "allow-declared"] },
            "max_hops": { "type": "integer", "minimum": 0, "maximum": 5 },
            "allowed_hosts": {
              "type": "array",
              "maxItems": 16,
              "uniqueItems": true,
              "items": { "$ref": "#/$defs/host" }
            }
          }
        },
        "inject_auth": { "type": "boolean", "default": true }
      }
    },
    "integrationSecretHandle": {
      "type": "string",
      "minLength": 1,
      "maxLength": 512,
      "pattern": "^(users|organizations)(?:/[A-Za-z0-9][A-Za-z0-9._:-]*)+$"
    },
    "auth": {
      "oneOf": [
        {
          "type": "object",
          "additionalProperties": false,
          "required": ["type", "header", "prefix", "placeholder", "secret_handle"],
          "properties": {
            "type": { "enum": ["bearer_header", "api_key_header"] },
            "header": { "type": "string", "pattern": "^[!#$%&'*+.^_`|~0-9A-Za-z-]+$" },
            "prefix": { "type": "string", "maxLength": 128, "pattern": "^[^\\u0000-\\u001F\\u007F]*$" },
            "placeholder": { "type": "string", "pattern": "^COGS_PLACEHOLDER_[A-Z0-9_]+$" },
            "secret_handle": { "$ref": "#/$defs/integrationSecretHandle" }
          }
        },
        {
          "type": "object",
          "additionalProperties": false,
          "required": ["type", "header", "placeholder", "secret_handle"],
          "properties": {
            "type": { "const": "basic_header" },
            "header": { "const": "Authorization" },
            "placeholder": { "type": "string", "pattern": "^COGS_PLACEHOLDER_[A-Z0-9_]+$" },
            "secret_handle": { "$ref": "#/$defs/integrationSecretHandle" }
          }
        }
      ]
    }
  }
}
